{
  "schemaVersion": "v1",
  "id": "delivery-receipt-0002",
  "deliveryRequestId": "delivery-request-0001",
  "ingressReceiptReference": {
    "resourceType": "ingress-receipt",
    "resourceId": "ingress-receipt-0001"
  },
  "provider": {
    "kind": "vitalserver",
    "id": "bundled-upstream-main",
    "capabilityRevision": 1
  },
  "attempt": 2,
  "outcome": {
    "state": "unavailable",
    "issue": {
      "code": "upstream-transport-unavailable",
      "retryable": true,
      "dependency": "bundled-upstream"
    }
  },
  "retry": {
    "state": "scheduled",
    "nextAttemptAt": "2026-07-17T00:00:06Z"
  },
  "completedAt": "2026-07-17T00:00:01Z"
}
